Experiences of discrimination,All,Low prestige,High prestige
Others have ridiculed my first language,40%,47%,7%
Others have said contemptuous or hurtful things about my language(s),37%,39%,29%
"I have been disadvantaged in school, university or job because of my language(s)",25%,28%,14%
I was told that one can (still) hear my specific societal class/ cultural background,21%,24%,7%
I was excluded by others because of my language(s),16%,18%,7%
Inappropriate inferences were made conferencing my outer appearance and my language skills,29%,32%,14%
I have had negative experiences in school concerning my language(s),34%,33%,3%